{
  "category": "death_registration",
  "service_name_en": "Death registration and certificate",
  "service_name_bn": "মৃত্যু নিবন্ধন",
  "office": "রেজিস্ট্রার জেনারেলের কার্যালয়, জন্ম ও মৃত্যু নিবন্ধন (Office of the Registrar General, Birth & Death Registration), Local Government Division",
  "locality": null,
  "variants": [
    {
      "variant_id": "death_registration_application",
      "label_en": "Death registration application",
      "label_bn": "মৃত্যু নিবন্ধনের আবেদন",
      "required_docs": [
        {
          "doc": "[one or more of] A certificate of declaration of death issued by the attending physician  ((ক))",
          "mandatory": false,
          "source_url": "https://orgbdr.gov.bd/pages/static-pages/birth-and-death-registration-rule-2018-w20ft9-69ca49704c09aebb3cb2f77d"
        },
        {
          "doc": "[one or more of] A death certificate issued by the relevant medical institution  ((খ))",
          "mandatory": false,
          "source_url": "https://orgbdr.gov.bd/pages/static-pages/birth-and-death-registration-rule-2018-w20ft9-69ca49704c09aebb3cb2f77d"
        },
        {
          "doc": "[one or more of] A copy of the post-mortem (ময়না তদন্ত) report for the deceased  ((গ))",
          "mandatory": false,
          "source_url": "https://orgbdr.gov.bd/pages/static-pages/birth-and-death-registration-rule-2018-w20ft9-69ca49704c09aebb3cb2f77d"
        },
        {
          "doc": "[one or more of] Any other death-related document the registrar considers necessary  ((ঘ))",
          "mandatory": false,
          "source_url": "https://orgbdr.gov.bd/pages/static-pages/birth-and-death-registration-rule-2018-w20ft9-69ca49704c09aebb3cb2f77d"
        },
        {
          "doc": "[if applying after 45 days] A written explanation of the reason for the delay, in addition to the certifications or documents already required  (Rule 11(9))",
          "mandatory": true,
          "source_url": "https://orgbdr.gov.bd/pages/static-pages/birth-and-death-registration-rule-2018-w20ft9-69ca49704c09aebb3cb2f77d"
        }
      ],
      "steps": [
        {
          "step": "Apply online for death registration.",
          "where": "https://bdris.gov.bd/dr/application",
          "source_url": "https://orgbdr.gov.bd/pages/static-pages/6922db5f933eb65569e09bfd"
        }
      ]
    }
  ],
  "fees": [
    {
      "fee_key": "death_01",
      "label_bn": "জন্ম বা মৃত্যুর ৪৫ (পঁয়তাল্লিশ) দিন পর্যন্ত কোন ব্যক্তির জন্ম বা মৃত্যু নিবন্ধন -",
      "amount_bdt": 0,
      "includes_vat": null,
      "source_url": "https://orgbdr.gov.bd/pages/static-pages/69cf48059d736d71f1a34c8c",
      "source_document": null,
      "source_last_updated": "2026-04-04",
      "verification": {
        "status": "source_read",
        "verified_by": "tools/build_records.py",
        "verified_date": "2026-09-05",
        "method": "official fee table on orgbdr.gov.bd, rows covering মৃত্যু নিবন্ধন"
      }
    },
    {
      "fee_key": "death_02",
      "label_bn": "জন্ম বা মৃত্যুর ৪৫ (পঁয়তাল্লিশ) দিন পর হইতে ৫ (পাঁচ) বৎসর পর্যন্ত কোন ব্যক্তির জন্ম বা মৃত্যু নিবন্ধন (সাকুল্য) -",
      "amount_bdt": 25,
      "includes_vat": null,
      "source_url": "https://orgbdr.gov.bd/pages/static-pages/69cf48059d736d71f1a34c8c",
      "source_document": null,
      "source_last_updated": "2026-04-04",
      "verification": {
        "status": "source_read",
        "verified_by": "tools/build_records.py",
        "verified_date": "2026-09-05",
        "method": "official fee table on orgbdr.gov.bd, rows covering মৃত্যু নিবন্ধন"
      }
    },
    {
      "fee_key": "death_03",
      "label_bn": "জন্ম বা মৃত্যুর ৫ (পাঁচ) বৎসর পর হইতে কোন ব্যক্তির জন্ম বা মৃত্যু নিবন্ধন (সাকুল্য) -",
      "amount_bdt": 50,
      "includes_vat": null,
      "source_url": "https://orgbdr.gov.bd/pages/static-pages/69cf48059d736d71f1a34c8c",
      "source_document": null,
      "source_last_updated": "2026-04-04",
      "verification": {
        "status": "source_read",
        "verified_by": "tools/build_records.py",
        "verified_date": "2026-09-05",
        "method": "official fee table on orgbdr.gov.bd, rows covering মৃত্যু নিবন্ধন"
      }
    }
  ],
  "office_location": "Union Parishad / Pourashava / City Corporation ward registrar office",
  "contact": null,
  "apply_portal": "https://bdris.gov.bd/dr/application",
  "source_url": "https://orgbdr.gov.bd/pages/static-pages/69cf48059d736d71f1a34c8c",
  "last_scraped_date": "2026-09-05",
  "source_last_updated": "2026-04-04",
  "verification": {
    "status": "source_read",
    "verified_by": "tools/build_records.py",
    "verified_date": "2026-09-05",
    "method": "official fee table on orgbdr.gov.bd"
  },
  "notes": [
    "ANTI-DALAL FACT (sourced): registration within 45 days of death is free (বিনা ফিসে), 25 BDT from 45 days to 5 years, 50 BDT after 5 years.",
    "Required documents come from the Birth & Death Registration Rules 2018 (statutory instrument), decoded from the gazette PDF - see data/checklists_bdr.json."
  ]
}