{
  "category": "vehicle_registration",
  "service_name_en": "Vehicle Registration",
  "service_name_bn": "মোটরযানের রেজিস্ট্রেশন (মোটরসাইকেল)",
  "office": "বাংলাদেশ সড়ক পরিবহন কর্তৃপক্ষ (Bangladesh Road Transport Authority)",
  "locality": null,
  "variants": [
    {
      "variant_id": "charter_row_0",
      "label_en": "মোটরযানের রেজিস্ট্রেশন (মোটরসাইকেল)",
      "label_bn": "মোটরযানের রেজিস্ট্রেশন (মোটরসাইকেল)",
      "required_docs": [
        {
          "doc": "(১) মোটর সাইকেল নিবন্ধনের ক্ষেত্রে কমপক্ষে লার্নার লাইসেন্স থাকতে হবে। (ক) একাধিক ব্যক্তি যৌথভাবে কোনো মোটরসাইকেলের মালিক হলে সে-ক্ষেত্রে একজনের নামে রেজিস্ট্রেশনের জন্য সকলের সম্মতি সম্বলিত হলফনামা; (খ) প্রতিষ্ঠান/কোম্পানির ক্ষেত্রে স্বাক্ষর ও সিলমোহর; (গ) ব্যাংক অথবা অর্থলগ্নি প্রতিষ্ঠানের সাথে গাড়ির মালিকানার আর্থিক সংশ্লিষ্টতা থাকলে সংশ্লিষ্ট প্রতিষ্ঠানের প্যাডে রেজিস্ট্রেশন কর্তৃপক্ষ বরাবর আ",
          "mandatory": true,
          "source_url": "https://brta.gov.bd/pages/office-citizen-charters/সেবা-প্রদান-প্রতিশ্রুতি-880924-6922d8a9933eb65569df99e1"
        },
        {
          "doc": "(২) বিল অব এন্ট্রি, ইনভয়েস, বিল অব লেডিং ও এলসিএ কপি;",
          "mandatory": true,
          "source_url": "https://brta.gov.bd/pages/office-citizen-charters/সেবা-প্রদান-প্রতিশ্রুতি-880924-6922d8a9933eb65569df99e1"
        },
        {
          "doc": "(৩) সেল সার্টিফিকেট /সেল ইন্টিমেশন/বিক্রয় প্রমাণপত্র (আমদানিকারক/বিক্রেতা প্রদত্ত);",
          "mandatory": true,
          "source_url": "https://brta.gov.bd/pages/office-citizen-charters/সেবা-প্রদান-প্রতিশ্রুতি-880924-6922d8a9933eb65569df99e1"
        },
        {
          "doc": "(৪) প্যাকিং লিস্ট, ডেলিভারী চালান ও গেইট পাশ (সিকেডি গাড়ির ক্ষেত্রে);",
          "mandatory": true,
          "source_url": "https://brta.gov.bd/pages/office-citizen-charters/সেবা-প্রদান-প্রতিশ্রুতি-880924-6922d8a9933eb65569df99e1"
        },
        {
          "doc": "(৫) বিদেশি নাগরিকের নামে রেজিস্ট্রেশন হলে বাংলাদেশের ওয়ার্ক পারমিট এবংভিসার মেয়াদের কপি; (৭) বিক্রকারী প্রতিষ্ঠানের ভ্যাট পরিশোধের চালান; (৮) প্রযোজ্য রেজিস্ট্রেশন ফি জমাদানের রসিদ; (৯) ব্যক্তি মালিকানাধীন আবেদনকারীর ক্ষেত্রে জাতীয় পরিচয়পত্র/ পাসপোর্ট/ টেলিফোন বিল/ বিদ্যুৎ বিল ইত্যাদির যে-কোনটির সত্যায়িত ফটোকপি এবং মালিক প্রতিষ্ঠান হলে প্রতিষ্ঠানের প্যাডে পত্র;",
          "mandatory": true,
          "source_url": "https://brta.gov.bd/pages/office-citizen-charters/সেবা-প্রদান-প্রতিশ্রুতি-880924-6922d8a9933eb65569df99e1"
        }
      ],
      "steps": [
        {
          "step": "সেবাগ্রহণকারীকে প্রয়োজনীয় রেজিস্ট্রেশন ফি জমা প্রদান করে সংশ্লিষ্ট বিআরটিএ অফিসে নির্ধারিত ফরমে ডিলার/শোরুমের মাধ্যমে অনলাইনে পূরণ করে প্রয়োজনীয় কাগজপত্রসহ মোটরসাইকেলের নিবন্ধনের জন্য আবেদন করতে হয়। আবেদনটি যাচাই-বাছাই করে সঠিক পাওয়াগেলে করতে হয়। মোটরসাইকেলটি পরিদর্শন করার পর মোটরযান পরিদর্শকের সুপারিশ সাপেক্ষে সহকারী পরিচালক(ইঞ্জি:) কর্তৃক রেজিস্ট্রেশনের প্রদান করা হয়।",
          "where": "বাংলাদেশ সড়ক পরিবহন কর্তৃপক্ষ (Bangladesh Road Transport Authority)",
          "source_url": "https://brta.gov.bd/pages/office-citizen-charters/সেবা-প্রদান-প্রতিশ্রুতি-880924-6922d8a9933eb65569df99e1"
        },
        {
          "step": "Stated service time: ০১ কার্যদিবস",
          "where": "বাংলাদেশ সড়ক পরিবহন কর্তৃপক্ষ (Bangladesh Road Transport Authority)",
          "source_url": "https://brta.gov.bd/pages/office-citizen-charters/সেবা-প্রদান-প্রতিশ্রুতি-880924-6922d8a9933eb65569df99e1"
        }
      ]
    },
    {
      "variant_id": "charter_row_1",
      "label_en": "মোটরযানের রেজিস্ট্রেশন ( মোটরসাইকেল ব্যতিত )",
      "label_bn": "মোটরযানের রেজিস্ট্রেশন ( মোটরসাইকেল ব্যতিত )",
      "required_docs": [
        {
          "doc": "( ১ ) মালিক ও আমদানিকারক / ডিলার কর্তৃক যথাযথভাবে পূরণ ও স্বাক্ষর করা নির্ধারিত আবেদনপত্র (H-Form)( বিআরটিএর ওয়েবসাইট www.brta.gov.bd-তে পাওয়া যাবে); ( ২ ) ব্যক্তি মালিকানাধীন আবেদনকারীর ক্ষেত্রে (ক)জাতীয় পরিচয়পত্র / পাসপোর্ট সত্যায়িত ফটোকপি; (খ)ঠিকানার প্রমানক হিসেবেইউটিলিটি বিল (টেলিফোন বিল / বিদ্যুৎ বিল ইত্যাদি) এর সত্যায়িত ফটোকপি; (গ) একাধিক ব্যক্তি যৌথভাবে কোনো গাড়ির মালিক হলে সে - ক্ষ",
          "mandatory": true,
          "source_url": "https://brta.gov.bd/pages/office-citizen-charters/সেবা-প্রদান-প্রতিশ্রুতি-880924-6922d8a9933eb65569df99e1"
        }
      ],
      "steps": [
        {
          "step": "সেবাগ্রহণকারীকে প্রয়োজনীয় রেজিস্ট্রেশন ফি জমা প্রদান করে সংশ্লিষ্ট বিআরটিএ অফিসে নির্ধারিত ফরমে ডিলার/শোরুমের মাধ্যমে অনলাইনে পূরণ করে প্রয়োজনীয় কাগজপত্রসহ মোটরসাইকেলের নিবন্ধনের জন্য আবেদন করতে হয়। আবেদনটি যাচাই-বাছাই করে সঠিক পাওয়াগেলে মোটরযানটি পরিদর্শন করার পর মোটরযান পরিদর্শকের সুপারিশ সাপেক্ষে সহকারী পরিচালক(ইঞ্জি:) কর্তৃক রেজিস্ট্রেশনের প্রদান করা হয়।",
          "where": "বাংলাদেশ সড়ক পরিবহন কর্তৃপক্ষ (Bangladesh Road Transport Authority)",
          "source_url": "https://brta.gov.bd/pages/office-citizen-charters/সেবা-প্রদান-প্রতিশ্রুতি-880924-6922d8a9933eb65569df99e1"
        },
        {
          "step": "Stated service time: ০১ কার্যদিবস",
          "where": "বাংলাদেশ সড়ক পরিবহন কর্তৃপক্ষ (Bangladesh Road Transport Authority)",
          "source_url": "https://brta.gov.bd/pages/office-citizen-charters/সেবা-প্রদান-প্রতিশ্রুতি-880924-6922d8a9933eb65569df99e1"
        }
      ]
    }
  ],
  "fees": [
    {
      "fee_key": "row0_unparsed",
      "label_bn": "মোটরযানের রেজিস্ট্রেশন (মোটরসাইকেল)",
      "label_en": "মোটরযানের রেজিস্ট্রেশন (মোটরসাইকেল)",
      "amount_bdt": null,
      "includes_vat": null,
      "source_url": "https://brta.gov.bd/pages/office-citizen-charters/সেবা-প্রদান-প্রতিশ্রুতি-880924-6922d8a9933eb65569df99e1",
      "source_document": null,
      "source_last_updated": "2021-09-23",
      "raw_text": "নিবন্ধনকালে প্রযোজ্য ফি : (ক) মোটরসাইকেলের ওজন ৯০ কেজি বা এর কম এবং ইঞ্জিন ক্যাপাসিটি ১০০সিসি বা এর কম হলে সর্বমোট ফি ৯,৩১৩/- । পরবর্তী ২ বছর পরপর প্রতিকিস্তি ১১৫০/- টাকা করে ৪টি কিস্তিতে অবশিষ্ট ৪৬০০/- টাকা রোড ট্যাক্স পরিশোধ করতে হবে। (খ) মোটরসাইকেলের ওজন ৯০কেজির বেশী ও ইঞ্জিন ক্যাপাসিটি ১০০ সিসি বা এর কম হলে সর্বমোট ফি ১০,৪৬৩/- । পরবর্তী ২ বছর পরপর প্রতিকিস্তি ২৩০০/- টাকা করে ৪টি কিস্তিতে অবশিষ্ট ৯২০০/- টাকা রোড ট্যাক্স পরিশোধ করতে হবে। (গ) মোটরসাইকেলের ওজন ৯০কেজি বা এর কম এবং ইঞ্জিন ক্যাপাসিটি ১০০সিসি&rsquo;র বেশী হলে সর্বমোট ফি ১০,৯২৩/- । পরবর্তী ২ বছর পরপর প্রতিকিস্তি ১১৫০/- টাকা করে ৪টি",
      "verification": {
        "status": "unverified",
        "verified_by": null,
        "verified_date": null,
        "method": "cell contains 8 amount(s) but is conditional/derived (ratio, instalment or table-based) - not reducible to one price"
      }
    },
    {
      "fee_key": "row1_unparsed",
      "label_bn": "মোটরযানের রেজিস্ট্রেশন ( মোটরসাইকেল ব্যতিত )",
      "label_en": "মোটরযানের রেজিস্ট্রেশন ( মোটরসাইকেল ব্যতিত )",
      "amount_bdt": null,
      "includes_vat": null,
      "source_url": "https://brta.gov.bd/pages/office-citizen-charters/সেবা-প্রদান-প্রতিশ্রুতি-880924-6922d8a9933eb65569df99e1",
      "source_document": null,
      "source_last_updated": "2021-09-23",
      "raw_text": "মোটরযানের রেজিস্ট্রেশনের সময় প্রদেয় মোট ফি গাড়ির সিসি, সিট সংখ্যা, বোঝাই গাড়ির ওজন ইত্যাদির উপর ভিত্তি করে নির্ধারণ করা রয়েছে, যার তালিকা বিআরটিএর ওয়েব (www.brta.gov.bd ) সাইটে রয়েছে। ১। মোটরযানের প্রকৃতি ও সিসি অনুযায়ী নিবন্ধন ফি ভিন্ন ভিন্ন হয়। (ফি-এর পূর্ন তালিকা বিআরটিএর ওয়েবসাইট www.brta.gov.bd-তে পাওয়া যাবে ) [এ ক্ষেত্রে ১৫% ভ্যাট প্রযোজ্য হবে] ২। ডিআরসি ফি ৫৫৫/- (ভ্যাটসহ) ৩। নাম্বার প্লেট ফি (ভ্যাটসহ) (ক) থ্রি-হুইলার ২২৬০/- (খ) অন্যান্য ৪৬২৮/- ২। ফিটনেস ফি (ভ্যাটসহ) (ক) হালকা গাড়ি: ১০৮৭ /- (খ) ভারি গাড়ি: ১৬০৫ /- ৩। মোটরযানের প্রকৃতি, আসন সংখ্যা অথবা বোঝাই গাড়ির ওজন এরউপর ভ",
      "verification": {
        "status": "unverified",
        "verified_by": null,
        "verified_date": null,
        "method": "no amount found in cell"
      }
    }
  ],
  "office_location": null,
  "contact": "সহকারী পরিচালক(ইঞ্জি:) ও রেজিস্ট্রেশন কর্তৃপক্ষ বিআরটিএ সার্কেল অফিস",
  "apply_portal": "https://bsp.brta.gov.bd/",
  "source_url": "https://brta.gov.bd/pages/office-citizen-charters/সেবা-প্রদান-প্রতিশ্রুতি-880924-6922d8a9933eb65569df99e1",
  "last_scraped_date": "2026-09-05",
  "source_last_updated": "2021-09-23",
  "verification": {
    "status": "source_read",
    "verified_by": "scrapers/v2ministry.py",
    "verified_date": "2026-09-05",
    "method": "parsed from the office citizen charter table"
  },
  "notes": [
    "Scraped from the V2Ministry CMS citizen charter. Columns located by header text.",
    "Fees marked unverified are ones whose charter cell is conditional, ratio-based or instalment-based; the raw cell text is kept in raw_text for a human to read.",
    "Not confirmed against a gazette/circular or with the office."
  ]
}