{
  "category": "income_tax_return",
  "service_name_en": "Income tax return filing (e-Return)",
  "service_name_bn": "আয়কর রিটার্ন দাখিল (ই-রিটার্ন)",
  "office": "জাতীয় রাজস্ব বোর্ড (National Board of Revenue, NBR)",
  "locality": null,
  "variants": [
    {
      "variant_id": "ereturn_online_filing",
      "label_en": "Online return filing (e-Return)",
      "label_bn": "অনলাইনে ই-রিটার্ন দাখিল",
      "required_docs": [
        {
          "doc": "TIN (Taxpayer's Identification Number)",
          "mandatory": true,
          "source_url": "https://nbr.gov.bd/uploads/news-scroller/FAQ_e-Return_-_2026.pdf"
        },
        {
          "doc": "A mobile phone number registered against your own NID (used for registration)",
          "mandatory": true,
          "source_url": "https://nbr.gov.bd/uploads/news-scroller/FAQ_e-Return_-_2026.pdf"
        }
      ],
      "steps": [
        {
          "step": "Register on the e-Return portal using your TIN and a mobile number registered against your own NID.",
          "where": "https://etaxnbr.gov.bd",
          "source_url": "https://nbr.gov.bd/uploads/news-scroller/FAQ_e-Return_-_2026.pdf"
        },
        {
          "step": "Sign in and update your profile details.",
          "where": "https://etaxnbr.gov.bd",
          "source_url": "https://nbr.gov.bd/uploads/news-scroller/FAQ_e-Return_-_2026.pdf"
        },
        {
          "step": "Enter income by category, investments, family expenditure, assets and liabilities, then submit the return.",
          "where": "https://etaxnbr.gov.bd",
          "source_url": "https://nbr.gov.bd/uploads/news-scroller/FAQ_e-Return_-_2026.pdf"
        },
        {
          "step": "Download the Acknowledgement slip and Tax certificate after submission.",
          "where": "https://etaxnbr.gov.bd",
          "source_url": "https://nbr.gov.bd/uploads/news-scroller/FAQ_e-Return_-_2026.pdf"
        }
      ]
    }
  ],
  "fees": [
    {
      "fee_key": "ereturn_filing",
      "label_en": "Online return filing",
      "amount_bdt": null,
      "includes_vat": null,
      "source_url": "https://nbr.gov.bd/uploads/news-scroller/FAQ_e-Return_-_2026.pdf",
      "source_document": "https://nbr.gov.bd/uploads/news-scroller/FAQ_e-Return_-_2026.pdf",
      "source_last_updated": "2026-07-16",
      "raw_text": null,
      "verification": {
        "status": "unverified",
        "verified_by": null,
        "verified_date": null,
        "method": "neither the e-Return FAQ nor the NBR citizen charter states a filing fee; absence of a stated fee is not evidence that it is free"
      }
    }
  ],
  "office_location": "Income tax circle office (অধিক্ষেত্র) for the taxpayer's jurisdiction",
  "contact": "e-Return helpdesk 09643717171; info@incometax.gov.bd",
  "apply_portal": "https://etaxnbr.gov.bd",
  "source_url": "https://nbr.gov.bd/uploads/news-scroller/FAQ_e-Return_-_2026.pdf",
  "last_scraped_date": "2026-09-05",
  "source_last_updated": "2026-07-16",
  "verification": {
    "status": "source_read",
    "verified_by": "tools/build_records.py",
    "verified_date": "2026-09-05",
    "method": "NBR e-Return FAQ 2026, decoded via tools/bn_pdf.py"
  },
  "notes": [
    "Steps are an English summary of NBR's Bengali FAQ, each citing that source. Verbatim Bengali was NOT used because the decoder still garbles this document's conjuncts.",
    "No filing fee is recorded - see the fee entry's verification note."
  ]
}