{
  "category": "nid_correction",
  "service_name_en": "NID correction",
  "service_name_bn": "এনআইডি সংশোধন",
  "office": "Bangladesh Election Commission",
  "locality": null,
  "variants": [],
  "fees": [],
  "office_location": null,
  "contact": null,
  "apply_portal": "https://services.nidw.gov.bd/",
  "source_url": "https://www.ecs.gov.bd/",
  "last_scraped_date": "2026-09-05",
  "source_last_updated": null,
  "verification": {
    "status": "unverified",
    "verified_by": null,
    "verified_date": null,
    "method": "www.ecs.gov.bd returns HTTP 403 behind a Cloudflare bot challenge (attempted once politely on 2026-09-04 and again on retry; not retried further by policy). services.nidw.gov.bd is login-walled and must not be scraped. The national portal e-services directory surfaced no NID procedure link. No public, fetchable procedure page was found."
  },
  "notes": [
    "NOT INGESTIBLE YET. www.ecs.gov.bd returns HTTP 403 behind a Cloudflare bot challenge (attempted once politely on 2026-09-04 and again on retry; not retried further by policy). services.nidw.gov.bd is login-walled and must not be scraped. The national portal e-services directory surfaced no NID procedure link. No public, fetchable procedure page was found.",
    "Deliberately left empty rather than filled from model knowledge (explain.md 5.1). The composer must answer 'not verified - contact the office' for this category."
  ]
}