{
  "category": "land_record",
  "service_name_en": "Land record (khatian) certified copy / porcha",
  "service_name_bn": "খতিয়ান / পর্চা (সার্টিফাইড কপি)",
  "office": "ভূমি রেকর্ড ও জরিপ অধিদপ্তর (Directorate of Land Records & Surveys), Ministry of Land",
  "locality": null,
  "variants": [
    {
      "variant_id": "khatian_certified_copy",
      "label_en": "Obtaining a khatian / certified copy (porcha)",
      "label_bn": "খতিয়ান প্রাপ্তি",
      "required_docs": [],
      "steps": [
        {
          "step": "During final publication (চূড়ান্ত প্রকাশনা), the khatian may be collected from the final publication camp under the Upazila Settlement Office, on payment of the government-fixed price.",
          "where": "Upazila Settlement Office publication camp",
          "source_url": "https://dlrs.gov.bd/pages/static-pages/6922dfd8933eb65569e2449b"
        },
        {
          "step": "After final publication ends, the records are transferred to the office of the relevant Deputy Commissioner (DC).",
          "where": "Deputy Commissioner's office",
          "source_url": "https://dlrs.gov.bd/pages/static-pages/6922dfd8933eb65569e2449b"
        },
        {
          "step": "Once transferred, the certified copy (porcha) of the khatian is collected from the DC's Record Room.",
          "where": "DC Record Room",
          "source_url": "https://dlrs.gov.bd/pages/static-pages/6922dfd8933eb65569e2449b"
        }
      ]
    }
  ],
  "fees": [
    {
      "fee_key": "khatian_certified_copy",
      "label_en": "Certified copy of khatian (porcha)",
      "label_bn": "সরকার নির্ধারিত মূল্য",
      "amount_bdt": null,
      "includes_vat": null,
      "source_url": "https://dlrs.gov.bd/pages/static-pages/6922dfd8933eb65569e2449b",
      "source_document": null,
      "source_last_updated": "2014-04-01",
      "verification": {
        "status": "unverified",
        "verified_by": null,
        "verified_date": null,
        "method": "source states only 'সরকার নির্ধারিত মূল্য' (government-fixed price) and prints no figure"
      }
    }
  ],
  "office_location": "Deputy Commissioner's Record Room (district), or Upazila Settlement Office during final publication",
  "contact": null,
  "apply_portal": "https://dlrms.land.gov.bd/",
  "source_url": "https://dlrs.gov.bd/pages/static-pages/6922dfd8933eb65569e2449b",
  "last_scraped_date": "2026-09-05",
  "source_last_updated": "2014-04-01",
  "verification": {
    "status": "source_read",
    "verified_by": "tools/build_records.py",
    "verified_date": "2026-09-05",
    "method": "DLRS page 'পর্চা/খতিয়ান কোথায় পাবেন'"
  },
  "notes": [
    "SEVERELY STALE: the source page self-reports last updated 2014-04-01. Treat the procedure as indicative and re-verify before presenting it.",
    "ANTI-DALAL FACT (sourced): the page states there is NO opportunity to obtain a certified copy (porcha) of a khatian from any office other than the DC's Record Room - 'জেলা প্রশাসকের রেকর্ড রুম ছাড়া অন্য কোন দপ্তর হতে খতিয়ানের সার্টিফাইড কপি (পর্চা) সংগ্রহের সুযোগ নেই'.",
    "Fee is deliberately null: the source names a government-fixed price but prints no amount.",
    "SOURCE CORRECTION: explain.md lists eporcha.gov.bd, which has no DNS. dlrs.gov.bd is the issuing directorate and was not in the original source list."
  ]
}