{
  "category": "birth_registration",
  "service_name_en": "Birth registration and certificate",
  "service_name_bn": "জন্ম নিবন্ধন",
  "office": "রেজিস্ট্রার জেনারেলের কার্যালয়, জন্ম ও মৃত্যু নিবন্ধন (Office of the Registrar General, Birth & Death Registration), Local Government Division",
  "locality": null,
  "variants": [
    {
      "variant_id": "birth_registration_application",
      "label_en": "Birth registration application",
      "label_bn": "জন্ম নিবন্ধনের আবেদন",
      "required_docs": [
        {
          "doc": "Proof of place and date of birth: the release certificate (ছাড়পত্র) from the medical institution, OR an attested copy of the birth certificate issued by that institution, OR certification from the birth attendant, OR other proof  (Rule 9(1)(ক)(অ))",
          "mandatory": true,
          "source_url": "https://orgbdr.gov.bd/pages/static-pages/birth-and-death-registration-rule-2018-w20ft9-69ca49704c09aebb3cb2f77d"
        },
        {
          "doc": "Proof of permanent address: an up-to-date tax payment receipt against the residence declared by the person, father, mother, grandfather or grandmother, OR the permanent address as declared in the National ID or passport of the father, mother, grandfather or grandmother  (Rule 9(1)(ক)(আ))",
          "mandatory": true,
          "source_url": "https://orgbdr.gov.bd/pages/static-pages/birth-and-death-registration-rule-2018-w20ft9-69ca49704c09aebb3cb2f77d"
        },
        {
          "doc": "Where applicable, to prevent duplicate registration: the birth registration number or National ID number of the person's father and mother, together with the corresponding certificate  (Rule 9(1)(ক)(আ))",
          "mandatory": false,
          "source_url": "https://orgbdr.gov.bd/pages/static-pages/birth-and-death-registration-rule-2018-w20ft9-69ca49704c09aebb3cb2f77d"
        },
        {
          "doc": "If the permanent address was lost to river erosion or a similar cause: the purchase deed for the land or house, plus khajna (land tax) and tax payment receipts for the new residence  (Rule 9(1)(ক)(ই))",
          "mandatory": false,
          "source_url": "https://orgbdr.gov.bd/pages/static-pages/birth-and-death-registration-rule-2018-w20ft9-69ca49704c09aebb3cb2f77d"
        },
        {
          "doc": "If the person has no permanent address: write 'অপ্রাপ্য' (not available) in that field and register with the registrar of the place of birth, with certification from the responsible officer that no permanent address exists  (Rule 9(1)(ক)(ঈ))",
          "mandatory": false,
          "source_url": "https://orgbdr.gov.bd/pages/static-pages/birth-and-death-registration-rule-2018-w20ft9-69ca49704c09aebb3cb2f77d"
        },
        {
          "doc": "A declaration on the application form by the applicant that no previous birth registration exists  (Rule 9(1)(ক)(উ))",
          "mandatory": true,
          "source_url": "https://orgbdr.gov.bd/pages/static-pages/birth-and-death-registration-rule-2018-w20ft9-69ca49704c09aebb3cb2f77d"
        },
        {
          "doc": "[if applying after 45 days] If applying within 5 years of birth: certification from the EPI (immunisation) worker on the completed application form, OR a copy of the EPI card  (Rule 9(1)(খ)(অ))",
          "mandatory": true,
          "source_url": "https://orgbdr.gov.bd/pages/static-pages/birth-and-death-registration-rule-2018-w20ft9-69ca49704c09aebb3cb2f77d"
        },
        {
          "doc": "[if applying after 45 days] If applying more than 5 years after birth: an age certificate issued by a competent physician  (Rule 9(1)(খ)(আ))",
          "mandatory": true,
          "source_url": "https://orgbdr.gov.bd/pages/static-pages/birth-and-death-registration-rule-2018-w20ft9-69ca49704c09aebb3cb2f77d"
        },
        {
          "doc": "[if applying after 45 days] A government-run Primary School Certificate or Junior School Certificate, or an education board Secondary School Certificate or equivalent  (Rule 9(1)(খ)(ই))",
          "mandatory": false,
          "source_url": "https://orgbdr.gov.bd/pages/static-pages/birth-and-death-registration-rule-2018-w20ft9-69ca49704c09aebb3cb2f77d"
        }
      ],
      "steps": [
        {
          "step": "Apply online for birth registration.",
          "where": "https://bdris.gov.bd/br/application",
          "source_url": "https://orgbdr.gov.bd/pages/static-pages/6922db5f933eb65569e09bfd"
        }
      ]
    }
  ],
  "fees": [
    {
      "fee_key": "bdr_01",
      "label_bn": "জন্ম বা মৃত্যুর ৪৫ (পঁয়তাল্লিশ) দিন পর্যন্ত কোন ব্যক্তির জন্ম বা মৃত্যু নিবন্ধন -",
      "amount_bdt": 0,
      "includes_vat": null,
      "source_url": "https://orgbdr.gov.bd/pages/static-pages/69cf48059d736d71f1a34c8c",
      "source_document": null,
      "source_last_updated": "2026-04-04",
      "verification": {
        "status": "source_read",
        "verified_by": "tools/build_records.py",
        "verified_date": "2026-09-05",
        "method": "parsed from the official fee table on orgbdr.gov.bd"
      }
    },
    {
      "fee_key": "bdr_02",
      "label_bn": "জন্ম বা মৃত্যুর ৪৫ (পঁয়তাল্লিশ) দিন পর হইতে ৫ (পাঁচ) বৎসর পর্যন্ত কোন ব্যক্তির জন্ম বা মৃত্যু নিবন্ধন (সাকুল্য) -",
      "amount_bdt": 25,
      "includes_vat": null,
      "source_url": "https://orgbdr.gov.bd/pages/static-pages/69cf48059d736d71f1a34c8c",
      "source_document": null,
      "source_last_updated": "2026-04-04",
      "verification": {
        "status": "source_read",
        "verified_by": "tools/build_records.py",
        "verified_date": "2026-09-05",
        "method": "parsed from the official fee table on orgbdr.gov.bd"
      }
    },
    {
      "fee_key": "bdr_03",
      "label_bn": "জন্ম বা মৃত্যুর ৫ (পাঁচ) বৎসর পর হইতে কোন ব্যক্তির জন্ম বা মৃত্যু নিবন্ধন (সাকুল্য) -",
      "amount_bdt": 50,
      "includes_vat": null,
      "source_url": "https://orgbdr.gov.bd/pages/static-pages/69cf48059d736d71f1a34c8c",
      "source_document": null,
      "source_last_updated": "2026-04-04",
      "verification": {
        "status": "source_read",
        "verified_by": "tools/build_records.py",
        "verified_date": "2026-09-05",
        "method": "parsed from the official fee table on orgbdr.gov.bd"
      }
    },
    {
      "fee_key": "bdr_04",
      "label_bn": "জন্ম তারিখ সংশোধনের জন্য আবেদন ফি -",
      "amount_bdt": 100,
      "includes_vat": null,
      "source_url": "https://orgbdr.gov.bd/pages/static-pages/69cf48059d736d71f1a34c8c",
      "source_document": null,
      "source_last_updated": "2026-04-04",
      "verification": {
        "status": "source_read",
        "verified_by": "tools/build_records.py",
        "verified_date": "2026-09-05",
        "method": "parsed from the official fee table on orgbdr.gov.bd"
      }
    },
    {
      "fee_key": "bdr_05",
      "label_bn": "জন্ম তারিখ ব্যতীত নাম, পিতার নাম, মাতার নাম, ঠিকানা ইত্যাদি অন্যান্য তথ্য সংশোধনের জন্য আবেদন ফি -",
      "amount_bdt": 50,
      "includes_vat": null,
      "source_url": "https://orgbdr.gov.bd/pages/static-pages/69cf48059d736d71f1a34c8c",
      "source_document": null,
      "source_last_updated": "2026-04-04",
      "verification": {
        "status": "source_read",
        "verified_by": "tools/build_records.py",
        "verified_date": "2026-09-05",
        "method": "parsed from the official fee table on orgbdr.gov.bd"
      }
    },
    {
      "fee_key": "bdr_06",
      "label_bn": "বাংলা ও ইংরেজি উভয় ভাষায় মূল সনদ বা তথ্য সংশোধনের পর সনদের কপি সরবরাহ",
      "amount_bdt": 0,
      "includes_vat": null,
      "source_url": "https://orgbdr.gov.bd/pages/static-pages/69cf48059d736d71f1a34c8c",
      "source_document": null,
      "source_last_updated": "2026-04-04",
      "verification": {
        "status": "source_read",
        "verified_by": "tools/build_records.py",
        "verified_date": "2026-09-05",
        "method": "parsed from the official fee table on orgbdr.gov.bd"
      }
    },
    {
      "fee_key": "bdr_07",
      "label_bn": "বাংলা ও ইংরেজি উভয় ভাষায় সনদের নকল সরবরাহ",
      "amount_bdt": 50,
      "includes_vat": null,
      "source_url": "https://orgbdr.gov.bd/pages/static-pages/69cf48059d736d71f1a34c8c",
      "source_document": null,
      "source_last_updated": "2026-04-04",
      "verification": {
        "status": "source_read",
        "verified_by": "tools/build_records.py",
        "verified_date": "2026-09-05",
        "method": "parsed from the official fee table on orgbdr.gov.bd"
      }
    }
  ],
  "office_location": "Union Parishad / Pourashava / City Corporation ward registrar office",
  "contact": null,
  "apply_portal": "https://bdris.gov.bd/br/application",
  "source_url": "https://orgbdr.gov.bd/pages/static-pages/69cf48059d736d71f1a34c8c",
  "last_scraped_date": "2026-09-05",
  "source_last_updated": "2026-04-04",
  "verification": {
    "status": "source_read",
    "verified_by": "tools/build_records.py",
    "verified_date": "2026-09-05",
    "method": "official fee table on orgbdr.gov.bd"
  },
  "notes": [
    "Fee page self-reports last updated 2026-04-04; services page 2026-04-03. Both current.",
    "ANTI-DALAL FACT: registration within 45 days of birth is free (বিনা ফিসে). This is the single most exploitable fact in this service and is stated by the official fee schedule.",
    "Required documents come from the Birth & Death Registration Rules 2018 (statutory instrument), decoded from the gazette PDF - see data/checklists_bdr.json.",
    "orgbdr.gov.bd has an incomplete certificate chain; fetched with verification disabled."
  ]
}